{
  "schema_version": "insight.v1",
  "insight_id": "a3b0c9d8-1e2f-4a5b-8c7d-6e5f4a3b2c1d",
  "source": "business-intelligence-system",
  "type": "anomaly",
  "kpi": "orders_count",
  "period": {"start": "2018-01-08", "end": "2018-01-08", "grain": "day"},
  "severity": "critical",
  "direction": "up",
  "observed": 121,
  "expected": 59.4,
  "deviation_pct": 103.7,
  "entity_refs": [
    {"type": "region", "id": "region:SP"},
    {"type": "kpi", "id": "kpi:orders_count"}
  ],
  "evidence": {
    "method": "stl_mad",
    "score": 7.3,
    "query_ref": "/api/v1/kpis/orders_count/series?from=2017-09-11&to=2018-01-08&dim=region&value=SP"
  },
  "summary": "Anzahl Bestellungen (Region SP) am 08.01.2018: 121 statt erwartet 59,4 (+103,7 %).",
  "data_class": "public",
  "created_at": "2026-10-08T09:12:51Z"
}
