{
  "schema_version": "insight.v1",
  "insight_id": "6f1c2d5e-0b7a-4c3e-9a1f-2d4b6c8e0a12",
  "source": "business-intelligence-system",
  "type": "anomaly",
  "kpi": "delivery_time_avg_days",
  "period": {"start": "2018-01-07", "end": "2018-01-07", "grain": "day"},
  "severity": "warning",
  "direction": "up",
  "observed": 27.9,
  "expected": 19.2,
  "deviation_pct": 45.6,
  "entity_refs": [{"type": "kpi", "id": "kpi:delivery_time_avg_days"}],
  "evidence": {
    "method": "stl_mad",
    "score": 4.9,
    "query_ref": "/api/v1/kpis/delivery_time_avg_days/series?from=2017-09-10&to=2018-01-07"
  },
  "context_ref": null,
  "summary": "Ø Lieferzeit (Tage) am 07.01.2018: 27,9 Tage statt erwartet 19,2 Tage (+45,6 %).",
  "data_class": "public",
  "created_at": "2026-10-08T09:12:44Z",
  "details": null
}
